{
  "schemaVersion": 1,
  "adapter": "convex",
  "package": {
    "ecosystem": "npm",
    "name": "@cerbos/orm-convex"
  },
  "workflow": ".github/workflows/convex.yaml",
  "commands": {
    "test": [
      "npm",
      "test"
    ],
    "typecheck": [
      "bash",
      "scripts/with-self-hosted-backend.sh",
      "npm",
      "run",
      "typecheck"
    ],
    "golden": [
      "npm",
      "run",
      "golden:update"
    ],
    "consumer": [
      "../demo/scripts/run-example.sh",
      "convex"
    ]
  },
  "semanticEnvironments": [
    {
      "name": "convex-self-hosted",
      "command": [
        "bash",
        "scripts/with-self-hosted-backend.sh",
        "npm",
        "run",
        "test:integration"
      ],
      "env": {}
    }
  ],
  "consumer": {
    "coverage": "artifact-install"
  },
  "outcomes": {
    "all-on-empty": {
      "status": "matched"
    },
    "arith-add": {
      "status": "matched"
    },
    "arith-add-eq-frac": {
      "status": "matched"
    },
    "arith-add-eq-frac-exact": {
      "status": "matched"
    },
    "arith-add-ne-frac": {
      "status": "matched"
    },
    "arith-both": {
      "status": "matched"
    },
    "arith-div": {
      "status": "matched"
    },
    "arith-div-frac": {
      "status": "matched"
    },
    "arith-mod": {
      "status": "matched"
    },
    "arith-mult-neg": {
      "status": "matched"
    },
    "arith-sub": {
      "status": "matched"
    },
    "arith-vf": {
      "status": "matched"
    },
    "cast-double-string": {
      "status": "matched"
    },
    "cast-int-double": {
      "status": "matched"
    },
    "cast-int-string": {
      "status": "matched"
    },
    "cast-string-bool": {
      "status": "matched"
    },
    "cast-string-double": {
      "status": "matched"
    },
    "concat-f2f": {
      "status": "matched"
    },
    "cr-contains": {
      "status": "matched"
    },
    "cr-div-neg-zero": {
      "status": "rejected",
      "reason": "IEEE keeps the sign of a zero, and the planner does ship it (the wire operand for -0.0 is `-0`), but a query plan is JSON-encoded on its way into a Convex function and JSON.stringify(-0) is \"0\" — the sign bit is gone before the adapter sees it, so it rejects a constant zero denominator rather than guess which infinity CEL produced",
      "message": "division by a constant zero whose sign is indeterminate: a query plan is JSON-encoded on its way into a Convex function and JSON has no -0, so the adapter cannot tell +Infinity from -Infinity"
    },
    "cr-div-other-column": {
      "status": "matched"
    },
    "cr-div-then-add": {
      "status": "matched"
    },
    "cr-div-then-add-ne": {
      "status": "matched"
    },
    "cr-div-zero": {
      "status": "matched"
    },
    "cr-div-zero-eq-neg": {
      "status": "matched"
    },
    "cr-div-zero-ne": {
      "status": "matched"
    },
    "cr-endswith": {
      "status": "matched"
    },
    "cr-size-frac-ge": {
      "status": "matched"
    },
    "cr-startswith": {
      "status": "matched"
    },
    "cr-startswith-concat": {
      "status": "matched"
    },
    "cs-contains": {
      "status": "matched"
    },
    "cs-endswith": {
      "status": "matched"
    },
    "cs-eq": {
      "status": "matched"
    },
    "cs-startswith": {
      "status": "matched"
    },
    "double-negation": {
      "status": "matched"
    },
    "double-threshold": {
      "status": "matched"
    },
    "empty-string-eq": {
      "status": "matched"
    },
    "exists-on-empty": {
      "status": "matched"
    },
    "exists-one-multi": {
      "status": "matched"
    },
    "f2f-contains": {
      "status": "matched"
    },
    "f2f-endswith": {
      "status": "matched"
    },
    "f2f-startswith": {
      "status": "matched"
    },
    "field-to-field": {
      "status": "matched"
    },
    "filter-as-condition": {
      "status": "rejected",
      "reason": "filter() used as the whole condition — it returns a list, not a boolean",
      "message": "filter() returns a list, not a boolean, so it cannot be a condition on its own; only size() over its result has a boolean meaning"
    },
    "filter-as-conjunct": {
      "status": "rejected",
      "reason": "filter() as a CONJUNCT rather than the whole condition — the same non-boolean, one level down",
      "message": "filter() returns a list, not a boolean, so it cannot be a condition on its own; only size() over its result has a boolean meaning"
    },
    "gt-bare": {
      "status": "matched"
    },
    "hier-ancestor-cf": {
      "status": "matched"
    },
    "hier-ancestor-ff": {
      "status": "matched"
    },
    "hier-bracket": {
      "status": "matched"
    },
    "hier-descendent-cf": {
      "status": "matched"
    },
    "hier-descendent-ff": {
      "status": "matched"
    },
    "hier-list-id": {
      "status": "rejected",
      "reason": "The descendant path is CONSTRUCTED by list() from a constant segment and the primary key. `list` is not in the adapter's known-operator set at all — it has never reached the wire from this corpus — so the shape is refused during structural validation, before the hierarchy operators around it are considered",
      "message": "Unsupported operator: list"
    },
    "hier-meta-in": {
      "status": "matched"
    },
    "hier-meta-like": {
      "status": "matched"
    },
    "hier-overlaps-cf": {
      "status": "matched"
    },
    "hier-overlaps-ff": {
      "status": "matched"
    },
    "hier-overlaps-meta": {
      "status": "matched"
    },
    "id-concat": {
      "status": "matched"
    },
    "id-concat-vf": {
      "status": "matched"
    },
    "id-eq-const": {
      "status": "matched"
    },
    "id-f2f": {
      "status": "matched"
    },
    "id-f2f-ne": {
      "status": "matched"
    },
    "in-empty": {
      "status": "matched"
    },
    "in-null-elem-hasint": {
      "status": "matched"
    },
    "in-null-elem-mixed": {
      "status": "matched"
    },
    "in-null-elem-neg": {
      "status": "matched"
    },
    "in-null-elem-only": {
      "status": "matched"
    },
    "in-null-elem-only-neg": {
      "status": "matched"
    },
    "in-null-elem-rel": {
      "status": "matched"
    },
    "in-null-elem-rel-neg": {
      "status": "matched"
    },
    "in-single": {
      "status": "matched"
    },
    "in-var-var": {
      "status": "matched"
    },
    "in-var-var-neg": {
      "status": "matched"
    },
    "index-scalar-list": {
      "status": "matched"
    },
    "lambda-field-to-field": {
      "status": "matched"
    },
    "lambda-in-principal": {
      "status": "matched"
    },
    "le-bare": {
      "status": "matched"
    },
    "like-backslash": {
      "status": "matched"
    },
    "like-bracket": {
      "status": "matched"
    },
    "like-percent": {
      "status": "matched"
    },
    "like-underscore": {
      "status": "matched"
    },
    "macro-depth3-all": {
      "status": "matched"
    },
    "macro-depth3-exists": {
      "status": "matched"
    },
    "macro-depth3-not-exists": {
      "status": "matched"
    },
    "map-as-condition": {
      "status": "rejected",
      "reason": "map() used as the whole condition — it returns a list, not a boolean",
      "message": "map() returns a list, not a boolean, so it cannot be a condition on its own; only size() over its result has a boolean meaning"
    },
    "map-eq-list": {
      "status": "matched"
    },
    "n-all-mixed-null": {
      "status": "matched"
    },
    "n-not-all-absorb": {
      "status": "matched"
    },
    "n-not-all-null": {
      "status": "matched"
    },
    "n-not-exists-one-null": {
      "status": "matched"
    },
    "nan-ord-inf": {
      "status": "rejected",
      "reason": "Same indeterminate-signed-zero rejection as cr-div-neg-zero: the 1.0/0.0 and -1.0/0.0 branches also carry a constant zero denominator, which survives the JSON hop as an unsigned 0",
      "message": "division by a constant zero whose sign is indeterminate: a query plan is JSON-encoded on its way into a Convex function and JSON has no -0, so the adapter cannot tell +Infinity from -Infinity"
    },
    "nan-ord-le": {
      "status": "matched"
    },
    "nan-ord-ternary": {
      "status": "matched"
    },
    "nan-ord-ternary-vf": {
      "status": "matched"
    },
    "nary-and": {
      "status": "matched"
    },
    "neg-number": {
      "status": "matched"
    },
    "not-and": {
      "status": "matched"
    },
    "not-contains": {
      "status": "matched"
    },
    "not-empty": {
      "status": "matched"
    },
    "not-exists": {
      "status": "matched"
    },
    "not-gt": {
      "status": "matched"
    },
    "not-lt": {
      "status": "matched"
    },
    "not-startswith": {
      "status": "matched"
    },
    "null-eq": {
      "status": "matched"
    },
    "null-eq-missing": {
      "status": "rejected",
      "reason": "`aOptionalString` follows the corpus default: a NULL column sends NO attribute, so `R.attr.aOptionalString == null` is a CEL missing-attribute error and check() denies all 21 seeds. The planner emits the same `eq(var, null)` node as `null-eq` (explicit null, 5 rows allowed), so the wire cannot tell the two conventions apart. Every adapter must be told which one the caller uses. Harnesses translate this action with the adapter's null representation set to `omitted` and assert a throw; under the default `explicit` the adapter would emit IS NULL and return the 5 rows the PDP denies (#302).",
      "message": "missing-attribute error"
    },
    "null-ne": {
      "status": "matched"
    },
    "null-not-eq": {
      "status": "matched"
    },
    "null-value-f2f": {
      "status": "matched"
    },
    "null-value-f2f-mixed": {
      "status": "matched"
    },
    "null-value-ne-const": {
      "status": "matched"
    },
    "null-value-not-eq-const": {
      "status": "matched"
    },
    "null-value-not-in-const": {
      "status": "matched"
    },